{
  "aop_version": "0.9",
  "id": "urn:aop:evidence:manifest-evidence-s1:v1",
  "kind": "evidence",
  "subject": {
    "id": "urn:aop:tool:web-fetch:v1",
    "digest": {
      "sha256": "1afbf15cdb42c958a7410db4d5aa59c2671cbe8519b5b27c943b8de03508c5d8"
    }
  },
  "predicateType": "https://slsa.dev/provenance/v1",
  "predicate": {
    "scenario": "v0.9/e2e/positive/scenario-1",
    "note": "Manifest evidence envelope (digest binding checked in later PR)."
  }
}
